{
  "documents": [
    {
      "canonical_source": "ATLAS.md",
      "path": "ATLAS.md",
      "section": "project",
      "title": "LudoWright Documentation Atlas"
    },
    {
      "canonical_source": "architecture/ARCHITECTURE_DOCUMENT_SET.md",
      "path": "architecture/ARCHITECTURE_DOCUMENT_SET.md",
      "section": "architecture",
      "title": "Architecture Document Set"
    },
    {
      "canonical_source": "architecture/SYSTEM_OVERVIEW.md",
      "path": "architecture/SYSTEM_OVERVIEW.md",
      "section": "architecture",
      "title": "System Overview"
    },
    {
      "canonical_source": "commands/ATLAS.md",
      "path": "commands/ATLAS.md",
      "section": "commands",
      "title": "ATLAS CLI"
    },
    {
      "canonical_source": "commands/ASSETS.md",
      "path": "commands/ASSETS.md",
      "section": "commands",
      "title": "Asset Registry, Discovery, Decomposition, and Workbook CLI"
    },
    {
      "canonical_source": "commands/INTERVIEW.md",
      "path": "commands/INTERVIEW.md",
      "section": "commands",
      "title": "Interview CLI"
    },
    {
      "canonical_source": "commands/DOCUMENTS.md",
      "path": "commands/DOCUMENTS.md",
      "section": "commands",
      "title": "Documents CLI"
    },
    {
      "canonical_source": "commands/DOCS.md",
      "path": "commands/DOCS.md",
      "section": "commands",
      "title": "Documentation audit CLI"
    },
    {
      "canonical_source": "contracts/ATLAS.md",
      "path": "contracts/ATLAS.md",
      "section": "contracts",
      "title": "Documentation ATLAS Contract"
    },
    {
      "canonical_source": "contracts/ASSET_DOMAIN.md",
      "path": "contracts/ASSET_DOMAIN.md",
      "section": "contracts",
      "title": "Asset Domain Contract"
    },
    {
      "canonical_source": "contracts/ASSET_TAXONOMY.md",
      "path": "contracts/ASSET_TAXONOMY.md",
      "section": "contracts",
      "title": "Asset Taxonomy Contract"
    },
    {
      "canonical_source": "contracts/ASSET_REGISTRY.md",
      "path": "contracts/ASSET_REGISTRY.md",
      "section": "contracts",
      "title": "Asset Registry Contract"
    },
    {
      "canonical_source": "contracts/ASSET_DISCOVERY.md",
      "path": "contracts/ASSET_DISCOVERY.md",
      "section": "contracts",
      "title": "Asset Discovery Contract"
    },
    {
      "canonical_source": "contracts/ASSET_DECOMPOSITION.md",
      "path": "contracts/ASSET_DECOMPOSITION.md",
      "section": "contracts",
      "title": "Asset Decomposition Contract"
    },
    {
      "canonical_source": "contracts/ASSET_WORKBOOK.md",
      "path": "contracts/ASSET_WORKBOOK.md",
      "section": "contracts",
      "title": "Asset Workbook Contract"
    },
    {
      "canonical_source": "contracts/ASSET_AUDIT.md",
      "path": "contracts/ASSET_AUDIT.md",
      "section": "contracts",
      "title": "Asset Audit Contract"
    },
    {
      "canonical_source": "contracts/CAPTURE_PROFILES.md",
      "path": "contracts/CAPTURE_PROFILES.md",
      "section": "contracts",
      "title": "Capture Profiles"
    },
    {
      "canonical_source": "contracts/HUMANOID_PROFILES.md",
      "path": "contracts/HUMANOID_PROFILES.md",
      "section": "contracts",
      "title": "Humanoid and Wearable Profiles"
    },
    {
      "canonical_source": "contracts/CREATURE_PROFILES.md",
      "path": "contracts/CREATURE_PROFILES.md",
      "section": "contracts",
      "title": "Creature and Animal Profiles"
    },
    {
      "canonical_source": "contracts/HARD_SURFACE_PROFILES.md",
      "path": "contracts/HARD_SURFACE_PROFILES.md",
      "section": "contracts",
      "title": "Environment and Hard-Surface Profiles"
    },
    {
      "canonical_source": "contracts/VISUAL_PROFILES.md",
      "path": "contracts/VISUAL_PROFILES.md",
      "section": "contracts",
      "title": "Foliage, UI, VFX, and Animation Profiles"
    },
    {
      "canonical_source": "contracts/VISUAL_BIBLE.md",
      "path": "contracts/VISUAL_BIBLE.md",
      "section": "contracts",
      "title": "Visual Bible Contract"
    },
    {
      "canonical_source": "contracts/PROMPT_COMPILER.md",
      "path": "contracts/PROMPT_COMPILER.md",
      "section": "contracts",
      "title": "Prompt Compiler Contract"
    },
    {
      "canonical_source": "contracts/CLI.md",
      "path": "contracts/CLI.md",
      "section": "contracts",
      "title": "Command-Line Interface Contract"
    },
    {
      "canonical_source": "contracts/DECISIONS_AND_APPROVALS.md",
      "path": "contracts/DECISIONS_AND_APPROVALS.md",
      "section": "contracts",
      "title": "Decisions and Approvals Contract"
    },
    {
      "canonical_source": "contracts/DEPENDENCY_GRAPH.md",
      "path": "contracts/DEPENDENCY_GRAPH.md",
      "section": "contracts",
      "title": "Dependency and Invalidation Graph"
    },
    {
      "canonical_source": "contracts/DOCUMENT_TEMPLATES.md",
      "path": "contracts/DOCUMENT_TEMPLATES.md",
      "section": "contracts",
      "title": "Document Template Engine"
    },
    {
      "canonical_source": "contracts/DOCUMENT_REFRESH.md",
      "path": "contracts/DOCUMENT_REFRESH.md",
      "section": "contracts",
      "title": "Incremental Document Refresh Contract"
    },
    {
      "canonical_source": "contracts/DOCUMENTATION_AUDIT.md",
      "path": "contracts/DOCUMENTATION_AUDIT.md",
      "section": "contracts",
      "title": "Documentation Audit Contract"
    },
    {
      "canonical_source": "contracts/EVENT_LOG.md",
      "path": "contracts/EVENT_LOG.md",
      "section": "contracts",
      "title": "Append-Only Project Event Log"
    },
    {
      "canonical_source": "contracts/IDENTIFIERS_AND_VERSIONS.md",
      "path": "contracts/IDENTIFIERS_AND_VERSIONS.md",
      "section": "contracts",
      "title": "Identifiers, Names, and Revision Versions"
    },
    {
      "canonical_source": "contracts/INTERVIEW_QUESTIONS.md",
      "path": "contracts/INTERVIEW_QUESTIONS.md",
      "section": "contracts",
      "title": "Interview Questions"
    },
    {
      "canonical_source": "contracts/JSON_SCHEMAS.md",
      "path": "contracts/JSON_SCHEMAS.md",
      "section": "contracts",
      "title": "JSON Schema Publication"
    },
    {
      "canonical_source": "contracts/MIGRATIONS.md",
      "path": "contracts/MIGRATIONS.md",
      "section": "contracts",
      "title": "Explicit Migration Framework"
    },
    {
      "canonical_source": "contracts/PROJECT_DOMAIN.md",
      "path": "contracts/PROJECT_DOMAIN.md",
      "section": "contracts",
      "title": "Project Domain Contract"
    },
    {
      "canonical_source": "contracts/PROJECT_FILESYSTEM.md",
      "path": "contracts/PROJECT_FILESYSTEM.md",
      "section": "contracts",
      "title": "Project Filesystem Contract"
    },
    {
      "canonical_source": "contracts/REFERENCES_AND_VISUAL_JOBS.md",
      "path": "contracts/REFERENCES_AND_VISUAL_JOBS.md",
      "section": "contracts",
      "title": "References and Visual Jobs"
    },
    {
      "canonical_source": "contracts/STATE_STORE.md",
      "path": "contracts/STATE_STORE.md",
      "section": "contracts",
      "title": "Rebuildable SQLite State Store"
    },
    {
      "canonical_source": "contracts/STRUCTURED_REPOSITORIES.md",
      "path": "contracts/STRUCTURED_REPOSITORIES.md",
      "section": "contracts",
      "title": "Structured JSON and YAML Repositories"
    },
    {
      "canonical_source": "decisions/0000-template.md",
      "path": "decisions/0000-template.md",
      "section": "decisions",
      "title": "ADR 0000: Decision title"
    },
    {
      "canonical_source": "decisions/0001-typed-identifiers-and-revision-versions.md",
      "path": "decisions/0001-typed-identifiers-and-revision-versions.md",
      "section": "decisions",
      "title": "ADR 0001: Typed identifiers and monotonic contract revisions"
    },
    {
      "canonical_source": "decisions/0002-immutable-project-aggregate.md",
      "path": "decisions/0002-immutable-project-aggregate.md",
      "section": "decisions",
      "title": "ADR 0002: Immutable project aggregate with separate stage and lifecycle"
    },
    {
      "canonical_source": "decisions/0003-revision-bound-approvals.md",
      "path": "decisions/0003-revision-bound-approvals.md",
      "section": "decisions",
      "title": "ADR 0003: Revision-bound approvals and immutable logical histories"
    },
    {
      "canonical_source": "decisions/0004-decomposed-asset-aggregate.md",
      "path": "decisions/0004-decomposed-asset-aggregate.md",
      "section": "decisions",
      "title": "ADR 0004: Decomposed asset aggregate with shared production status"
    },
    {
      "canonical_source": "decisions/0005-immutable-visual-jobs-and-receipts.md",
      "path": "decisions/0005-immutable-visual-jobs-and-receipts.md",
      "section": "decisions",
      "title": "ADR 0005: Immutable Visual Jobs and Attempt Receipts"
    },
    {
      "canonical_source": "decisions/0006-exact-versioned-capture-profile-inheritance.md",
      "path": "decisions/0006-exact-versioned-capture-profile-inheritance.md",
      "section": "decisions",
      "title": "ADR 0006: Exact Versioned Capture-Profile Inheritance"
    },
    {
      "canonical_source": "decisions/0007-generated-versioned-json-schemas.md",
      "path": "decisions/0007-generated-versioned-json-schemas.md",
      "section": "decisions",
      "title": "ADR 0007: Generated and Versioned JSON Schemas"
    },
    {
      "canonical_source": "decisions/0008-safe-project-filesystem-boundary.md",
      "path": "decisions/0008-safe-project-filesystem-boundary.md",
      "section": "decisions",
      "title": "ADR 0008: Safe Project Filesystem Boundary"
    },
    {
      "canonical_source": "decisions/0009-canonical-structured-document-repositories.md",
      "path": "decisions/0009-canonical-structured-document-repositories.md",
      "section": "decisions",